{
  "title": "Spage",
  "description": "Simple writing. Super performance. Share your story!",
  "logo": "/logo.svg",
  "favicon": "/favicon.ico",
  "siteUrl": "https://spage.me",
  "author": "Suzichen",
  "language": "en",
  "timezone": "Asia/Tokyo",
  "links": {
    "enabled": true,
    "items": {
      "Suzic's Blog": "https://s-blog.suzichen.me/"
    }
  },
  "socialLinks": {
    "enabled": true,
    "items": [
      { "platform": "rss" },
      { "platform": "email", "url": "mailto:mail@suzichen.me" },
      { "platform": "github", "url": "https://github.com/Suzichen/spage" }
    ]
  }
}
